{
  "current_page": 1,
  "data": [
    { "breed": "Abyssinian", "country": "Ethiopia", "origin": "Natural/Standard", "coat": "Short", "pattern": "Ticked" },
    { "breed": "Aegean", "country": "Greece", "origin": "Natural/Standard", "coat": "Semi-long", "pattern": "Bi- or tri-colored" }
  ],
  "first_page_url": "https://catfact.ninja/breeds?page=1",
  "from": 1,
  "last_page": 49,
  "last_page_url": "https://catfact.ninja/breeds?page=49",
  "links": [
    { "url": null, "label": "Previous", "active": false },
    { "url": "https://catfact.ninja/breeds?page=1", "label": "1", "active": true },
    { "url": "https://catfact.ninja/breeds?page=2", "label": "2", "active": false },
    { "url": "https://catfact.ninja/breeds?page=2", "label": "Next", "active": false }
  ],
  "next_page_url": "https://catfact.ninja/breeds?page=2",
  "path": "https://catfact.ninja/breeds",
  "per_page": 2,
  "prev_page_url": null,
  "to": 2,
  "total": 98
}
